body,created_at,location,pictures,product_title,product_url,rating,review_id,reviewer_name,title,verified_buyer
Nice and pretty,2024-06-24 06:06:12 UTC,"(Kuala Lumpur, Malaysia)",https://judgeme.imgix.net/tudungpeople/1719209172__screenshot2024-06-24at20035pm__original.png?auto=format&w=1024,Hijab Ring - Iris,/products/hijab-ring-iris,5,ad20f0fa-1477-4c63-b6d2-d23473f1ba1f,Azreena,Hijab Ring,True
Love this hijab ring since it can be wear with square scarf for any occassion.,2024-05-26 07:08:16 UTC,"(Kuala Lumpur, Malaysia)",https://judgeme.imgix.net/tudungpeople/1716707296__img_7537__original.jpeg?auto=format&w=1024,Hijab Ring - Clover,/products/hijab-ring-clover,5,fa93b94e-b7af-430c-b098-a791a8e4cb0a,Norlaili Arif,Simple design with elegan look,True
Great!,2026-02-19 12:20:26 UTC,"(Petaling Jaya, Malaysia)",,Hijab Ring - Calla,/products/hijab-ring-calla,5,03c35b92-d103-4eac-b7ef-0e9d44d6dc94,Aniza Abd Manaf,,True
The ring add an elegant finish to my hijab style without trying to much.,2026-01-05 02:00:31 UTC,"(Kuala Lumpur, Malaysia)",,Hijab Ring - Juliet,/products/hijab-ring-juliet,5,fa594221-a06e-4f5b-b028-e8f83eac51b6,A millennial gal,Elegant accessory to hijab style,True
"It's easy to use, it can hold niya satin well since it's not too wide. It's simple enough to wear with all hijab.",2025-12-28 09:45:58 UTC,"(Puchong Batu Dua Belas, Malaysia)",,Hijab Ring - Scarlett,/products/hijab-ring-scarlett,5,5aa127e9-4180-42f2-ace6-1d37e7641e75,Amy,Practicle and cute.,True
"Besar, boleh tarik sampai atas ring ni, especially kalau tudung jenis kain yg tebal.",2025-12-16 09:03:02 UTC,"(Kuala Lumpur, Malaysia)",,Hijab Ring - Marquise,/products/hijab-ring-marquise,5,bef5268e-bba3-4dc0-8af7-0492ca36e180,Didy,,True
Easy to wear,2025-12-10 07:16:44 UTC,,,Hijab Ring - Scarlett,/products/hijab-ring-scarlett,5,b1d26ff2-e43c-471a-b238-3febace5b2f4,Noorul nadya Shaharum,,True
minimalist yet modern design!!! serving trendy lookkkk,2025-09-10 09:47:10 UTC,"(Petaling Jaya, Malaysia)",,Hijab Ring - Aurora,/products/hijab-ring-aurora,5,222aa010-3f79-423c-b804-596c81553ba3,NHM,Minimalist design,True
